"UF;CIDADE;UNIDADE;ENDEREÇO;URL";
"PE;RECIFE;AFOGADOS; Rua São Miguel, 176;https://evo-totem.w12app.com.br/selfit/257/site/landing-page/checkout/15565/0";
"CE;FORTALEZA;ALDEOTA; Rua Eduardo Garcia, 300;https://evo-totem.w12app.com.br/selfit/252/site/landing-page/checkout/15560/0";
"SP;SÃO PAULO;ARAPANÉS; Alameda dos Arapanés, 685;https://admin.selfitacademias.com.br/selfit/207/site/landing-page/checkout/15541/0";
"RJ;RIO DE JANEIRO;BARÃO DE ITAMBI; Rua Barão de Itambi, 50;https://evo-totem.w12app.com.br/selfit/206/site/landing-page/checkout/15540/0";
"BA;SALVADOR;BARRA; Rua Augusto Frederico Schmith, 95;https://evo-totem.w12app.com.br/selfit/104/site/landing-page/checkout/15488/0";
"BA;SALVADOR;BARRA HALL; Rua César Zama, 316;https://evo-totem.w12app.com.br/selfit/125/site/landing-page/checkout/15506/0";
"PB;JOÃO PESSOA;BESSA;R. Bacharel Jose de Oliveira Curchatuz, s/n - loja 068;https://evo-totem.w12app.com.br/selfit/260/site/landing-page/checkout/15568/0";
"CE;FORTALEZA;BEZERRA DE MENEZES; Av. Bezerra de Menezes, 1811;https://evo-totem.w12app.com.br/selfit/143/site/landing-page/checkout/15521/0";
"PE;RECIFE;BOA VIAGEM; Rua Visconde de Jequitinhonha, 2314;https://evo-totem.w12app.com.br/selfit/240/site/landing-page/checkout/15549/0";
"PE;RECIFE;BOA VIAGEM II; Rua Bruno Veloso, 528;https://evo-totem.w12app.com.br/selfit/240/site/landing-page/checkout/15549/0";
"BA;VITÓRIA DA CONQUISTA;BOULEVARD SHOPPING; Av. Olivia Flores, 2500;https://evo-totem.w12app.com.br/selfit/164/site/landing-page/checkout/15532/0";
"MA;SÃO LUÍS;BOULEVARD TROPICAL;Av. Colares Moreira, 400;https://evo-totem.w12app.com.br/selfit/124/site/landing-page/checkout/15505/0";
"BA;SALVADOR;CAMINHO DAS ÁRVORES;Alameda das Cajazeiras, 59;https://evo-totem.w12app.com.br/selfit/262/site/landing-page/checkout/15570/0";
"PB;CAMPINA GRANDE;CAMPINA GRANDE; Rua Dr. Severino Cruz, 771;https://evo-totem.w12app.com.br/selfit/130/site/landing-page/checkout/15510/0";
"SP;SOROCABA;CAMPOLIM; Rua Maria Aparecida Pessitti Milego, 250;https://evo-totem.w12app.com.br/selfit/146/site/landing-page/checkout/15523/0";
"SP;CARAPICUÍBA;CARAPICUÍBA; Av. Des. Eduardo de Abreu, 1455;https://admin.selfitacademias.com.br/selfit/149/site/landing-page/checkout/15525/0";
"SP;JUNDIAÍ;CARREFOUR JUNDIAÍ; Av. Profa. Maria do Carmo Guimaraes;https://evo-totem.w12app.com.br/selfit/162/site/landing-page/checkout/15530/0";
"PE;RECIFE;CARUARU; Av. Oswaldo Cruz, 217;https://evo-totem.w12app.com.br/selfit/109/site/landing-page/checkout/15491/0";
"PE;RECIFE;CASA AMARELA;R. Desembargador Gois Cavalcante, 12;https://evo-totem.w12app.com.br/selfit/261/site/landing-page/checkout/15569/0";
"PE;OLINDA;CASA CAIADA;Av Gov.Cralos de Lima Cavalcante,1306;https://evo-totem.w12app.com.br/selfit/270/site/landing-page/checkout/15578/0";
"MG;BELO HORIZONTE;CIDADE JARDIM; Rua Iraí, 235;https://evo-totem.w12app.com.br/selfit/138/site/landing-page/checkout/15517/0";
"SP;SÃO JOSÉ DOS CAMPOS;COLINAS; Av. Jorge Zarur, 100;https://evo-totem.w12app.com.br/selfit/140/site/landing-page/checkout/15518/0";
"RJ;RIO DE JANEIRO;CONDE DE BONFIM; Rua Conde de Bonfim, 186;https://evo-totem.w12app.com.br/selfit/201/site/i%5BPLUS%5D0qGeaytuJiOBpWXvZNgA%5BEQUAL%5D%5BEQUAL%5D";
"BA;SALVADOR;COSTA AZUL; Rua Adelaide Fernandes da Costa, 903;https://evo-totem.w12app.com.br/selfit/117/site/y1Ce2URCFqfuU9VS0qfVpw%5BEQUAL%5D%5BEQUAL%5D";
"MA;SÃO LUIS;DANIEL DE LA TOUCHE; Av. Daniel de la Touche, 01;https://evo-totem.w12app.com.br/selfit/202/site/landing-page/checkout/15536/0";
"CE;FORTALEZA;DOM LUIS;Av. Dom Luís, 1200;https://evo-totem.w12app.com.br/selfit/128/site/landing-page/checkout/15508/0";
"PB;JOÃO PESSOA;EPITÁCIO PESSOA;Av. Epitacio Pessoa, 3001;https://evo-totem.w12app.com.br/selfit/108/site/landing-page/checkout/15490/0";
"MT;CUIABÁ;ESTAÇÃO CUIABÁ; Av. Miguel Sutil, 9300;https://evo-totem.w12app.com.br/selfit/227/site/landing-page/checkout/15544/0";
"BA;FEIRA DE SANTANA ;FEIRA DE SANTANA; Rua Cel. José Pinto dos Santos, S/N;https://evo-totem.w12app.com.br/selfit/120/site/landing-page/checkout/15501/0";
"SP;RIO PRETO;GLICERIO;R. Gen. Glicério, 3733 ;https://evo-totem.w12app.com.br/selfit/156/site/landing-page/checkout/15526/0";
"CE;FORTALEZA;GODOFREDO MACIEL; Av. Godofredo Maciel, 4035;https://evo-totem.w12app.com.br/selfit/259/site/cKXaN4HqE9Q9pQDLIzDafQ%5BEQUAL%5D%5BEQUAL%5D";
"MA;SÃO LUIS;GOLDEN SHOPPING; Av. dos Holandesesm 200;https://evo-totem.w12app.com.br/selfit/133/site/landing-page/checkout/15513/0";
"PI;TERESINA;HOMERO CASTELO BRANCO;Av. Homero Castelo Branco, 1.070 ;https://evo-totem.w12app.com.br/selfit/263/site/landing-page/checkout/15571/0";
"RJ;NITERÓI;ICARAÍ; Av. Sete de Setembro, 291;https://evo-totem.w12app.com.br/selfit/224/site/landing-page/checkout/15542/0";
"PA;BELÉM;IT CENTER; Av. Senador Lemos, 3153;https://evo-totem.w12app.com.br/selfit/132/site/landing-page/checkout/15512/0";
"MT;CUIABÁ;JARDIM DAS AMÉRICAS; Av. Fernando Corrêa da Costa, 1255;https://evo-totem.w12app.com.br/selfit/226/site/landing-page/checkout/15543/0";
"SE;ARACAJU;JARDINS; Av. Marieta Leite, 3;https://evo-totem.w12app.com.br/selfit/123/site/OQoFuaVZcNCo9CnVOb3kuA%5BEQUAL%5D%5BEQUAL%5D";
"PE;RECIFE;JEAN EMILE; Rua Jean Emile Favre, 685;https://evo-totem.w12app.com.br/selfit/245/site/landing-page/checkout/15553/0";
"RN;LAGOA NOVA;LAGOA NOVA; Av. Sem. Salgado Filho, 1656;https://evo-totem.w12app.com.br/selfit/115/site/landing-page/checkout/15496/0";
"SP;SÃO PAULO;LAR CENTER; Av. Otto Baumgart, 500;https://admin.selfitacademias.com.br/selfit/199/site/landing-page/checkout/15533/0";
"BA;LAURO DE FREITAS;LAURO DE FREITAS; Av. Luiz Tarquinio Pontes, 2603;https://evo-totem.w12app.com.br/selfit/228/site/landing-page/checkout/15545/0";
"PE;RECIFE;MADALENA; Rua Prof. Benedito Monteiro, 224;https://evo-totem.w12app.com.br/selfit/131/site/landing-page/checkout/15511/0";
"PB;JOÃO PESSOA;MAG SHOPPING;  Av. Gov. Flávio Ribeiro Coutinho, 115;https://evo-totem.w12app.com.br/selfit/106/site/landing-page/checkout/15489/0";
"AM;MANAUS;MANAUS PLAZA SHOPPING; Av. Djalma Batista, 2100;https://evo-totem.w12app.com.br/selfit/205/site/landing-page/checkout/15539/0";
"PB;JOÃO PESSOA;MANGABEIRA; Av. Hilton Souto Maior, 3904;https://evo-totem.w12app.com.br/selfit/103/site/landing-page/checkout/15487/0";
"AL;MACEIÓ;MANGABEIRAS; Av. Comendador Gustavo Paiva, 3261;https://evo-totem.w12app.com.br/selfit/119/site/landing-page/checkout/15500/0";
"SP;MARÍLIA;MARILIA SHOPPING;R. dos Tucunarés, 500;https://evo-totem.w12app.com.br/selfit/158/site/landing-page/checkout/15527/0";
"BA;SALVADOR;MATATU; Rua Barros de Falcão, 21;https://evo-totem.w12app.com.br/selfit/238/site/landing-page/checkout/15547/0";
"PA;SANTARÉM;MENDONÇA FURTADO; Av. Mendonça Furtado;https://evo-totem.w12app.com.br/selfit/159/site/landing-page/checkout/15528/0";
"AM;MANAUS;N.SRA DAS GRAÇAS;Av. João Valério, 708;https://evo-totem.w12app.com.br/selfit/121/site/landing-page/checkout/15502/0";
"PE;PAULISTA;NORTHWAY; Rodovia 15, km 16,5;https://evo-totem.w12app.com.br/selfit/239/site/landing-page/checkout/15548/0";
"RN;PARNAMIRIM;NOVA PARNAMIRIM; Rua Anibal Brandão, 334;https://evo-totem.w12app.com.br/selfit/251/site/landing-page/checkout/15559/0";
"RJ;RIO DE JANEIRO;OLARIA; Rua Leopoldina Rêgo, 666;https://evo-totem.w12app.com.br/selfit/200/site/landing-page/checkout/15534/0";
"PA;BELÉM;PARQUE SHOPPING BELEM;Rod. Augusto Montenegro, 4300;https://evo-totem.w12app.com.br/selfit/134/site/landing-page/checkout/15514/0";
"AL;MACEIÓ;PARQUE SHOPPING MACEIÓ; Av. Comendador Gustavo Paiva, 5945;https://evo-totem.w12app.com.br/selfit/203/site/landing-page/checkout/15537/0";
"SP;RIBEIRÃO PRETO;PRESIDENTE VARGAS;Av. Presidente Varga, 1617;https://evo-totem.w12app.com.br/selfit/148/site/landing-page/checkout/15524/0";
"BA;SALVADOR;PARALELA;Av. Luis Viana, 3.056;https://evo-totem.w12app.com.br/selfit/269/site/landing-page/checkout/15577/0";
"PE;JABOATÃO;PIEDADE ; Rua Nossa Senhora de Fátima, 239;https://evo-totem.w12app.com.br/selfit/116/site/landing-page/checkout/15497/0";
"PE;JABOATÃO;PIEDADE 2; Rua Paraíba, 476;https://evo-totem.w12app.com.br/selfit/288/site/landing-page/checkout/15594/0";
"RN;NATAL;PONTA NEGRA; Rua Cabo de São Roque, 8805;https://evo-totem.w12app.com.br/selfit/122/site/landing-page/checkout/15503/0";
"AL;MACEIÓ;PONTA VERDE; Rua Deputado José Lages, 3283;https://evo-totem.w12app.com.br/selfit/111/site/landing-page/checkout/15493/0";
"PI;TERESINA;PRESIDENTE KENNEDY;Av. Pres. Kennedy, 840;https://evo-totem.w12app.com.br/selfit/142/site/landing-page/checkout/15520/0";
"BA;SALVADOR;RIO VERMELHO; Rua Conselheiro Pedro Luiz, 92;https://evo-totem.w12app.com.br/selfit/114/site/landing-page/checkout/15495/0";
"PI;TERESINA;RIVERSIDE; Av. Ininga, 1201;https://evo-totem.w12app.com.br/selfit/113/site/landing-page/checkout/15494/0";
"PE;RECIFE;ROSA E SILVA; Av. Cons. Rosa e Silva, 797;https://evo-totem.w12app.com.br/selfit/126/site/landing-page/checkout/15507/0";
"SP;SÃO PAULO;SANTA CLARA;Rua Buenópolis, 144;https://evo-totem.w12app.com.br/selfit/229/site/landing-page/checkout/15546/0";
"SP;SOROCABA;SANTA ROSALIA;R. Maria Cinto de Biagi, 164;https://evo-totem.w12app.com.br/selfit/144/site/landing-page/checkout/15522/0";
"RN;SÃO GONÇALO DO AMARANTE;SÃO GONÇALO DO AMARANTE;Av. Benedito Santana, 5;https://evo-totem.w12app.com.br/selfit/264/site/landing-page/checkout/15572/0";
"BA;SALVADOR;SÃO RAFAEL; Estrada do Mandu, 56;https://evo-totem.w12app.com.br/selfit/110/site/landing-page/checkout/15492/0";
"CE;FORTALEZA;SCOPA PLATINUM; Rua Monsenhor Bruno, 1153;https://evo-totem.w12app.com.br/selfit/129/site/landing-page/checkout/15509/0";
"CE;FORTALEZA;SHOPPING PARANGABA; Rua Germano Franck, 300;https://evo-totem.w12app.com.br/selfit/204/site/landing-page/checkout/15538/0";
"PA;MARABÁ;SHOPPING PARTAGE MARABÁ;Rodovia Transamazônica, Folha 30;https://evo-totem.w12app.com.br/selfit/135/site/landing-page/checkout/15515/0";
"SP;RIO CLARO;SHOPPING RIO CLARO;Av. Condé Francisco Matarazzo Júnior, 205;https://evo-totem.w12app.com.br/selfit/137/site/landing-page/checkout/15516/0";
"PE;PETROLINA;TANCREDO NEVES; Av. Presidente Tancredo Neves, 1079;https://evo-totem.w12app.com.br/selfit/163/site/landing-page/checkout/15531/0";
"MA;SÃO LUIS;TURU; Av. São Luis Rei da França, 140;https://evo-totem.w12app.com.br/selfit/242/site/landing-page/checkout/15551/0";
"CE;FORTALEZA;VIA SUL; Av. Washington Soares, 4335;https://evo-totem.w12app.com.br/selfit/254/site/landing-page/checkout/15562/0";
"CE;FORTALEZA;WASHINGTON SOARES; Av. Washington Soares, 3000;https://evo-totem.w12app.com.br/selfit/141/site/landing-page/checkout/15519/0";
"PE;CAMARAGIBE;CAMARÁ SHOPPING;Rua Manoel Honorato da Costa, 555;https://evo-totem.w12app.com.br/selfit/276/site/landing-page/checkout/15583/0";
"MA;SÃO LUIS;TIRIRICAL;Av. Lourenço Vieira da Silva, 2.363;https://evo-totem.w12app.com.br/selfit/286/site/landing-page/checkout/15592/0";
"PI;TERESINA;DIRCEU;R. Joaquim Nelson, 2743 - Parque Ideal,;https://evo-totem.w12app.com.br/selfit/279/site/landing-page/checkout/15586/0";
"SP;SÃO JOSÉ DOS CAMPOS;OSWALDO CRUZ;Av. Dr. Nelson D'Ávila, 1.941, Térreo Loja - Jardim São Dima;https://evo-totem.w12app.com.br/selfit/160/site/landing-page/checkout/15529/0";
"PE;JABOATÃO;BERNARDO VIEIRA DE MELO ;Av. Bernardo Vieira de Melo, 941 - Piedade;https://evo-totem.w12app.com.br/selfit/278/site/landing-page/checkout/15585/0";
"RN;PARNAMIRIM;ABEL CABRAL;Av. Abel Cabral, S/N - Nova Parnamirim;https://evo-totem.w12app.com.br/selfit/290/site/landing-page/checkout/15596/0";
"CE;FORTALEZA;JAIME BENÉVOLO; Jaime Benévolo, 1.188, 1.190 e 1.200 - José Bonifácio,;https://evo-totem.w12app.com.br/selfit/289/site/landing-page/checkout/15595/0";
"RN;NATAL;TIROL;Av Hermes da Fonseca, 1148 - Tirol;https://evo-totem.w12app.com.br/selfit/277/site/landing-page/checkout/15584/0";
"SE;ARACAJU;AUGUSTO FRANCO;Av . Augusto Franco 2.500;https://evo-totem.w12app.com.br/selfit/272/site/landing-page/checkout/15580/0";
"SP;FRANCA;FRANCA ;Av. Dr. Esmael Alonso Y Alonso, 1789 - Centro, Franca - SP, Brasil;https://evo-totem.w12app.com.br/selfit/283/site/landing-page/checkout/15589/0";
